{
  "name": "a session refuses with the code its vocabulary names, and the same code in either language",
  "layer": "session",
  "replaces": "session/go/sessiontest and session/ts/src/conformance.ts, across the wire",
  "description": "What a session call refuses with is the API a consumer's server is written against: a code a program branches on, never prose it would have to match. Negative registry limits are refused with invalid_options; no_session, role_invalid, sequence_invalid, too_many_attachments, session_exists and not_controlling are each provoked on a session that stands, and the session still routing afterwards.",
  "needs": [
    "lazy",
    "peer",
    "pipe",
    "seam",
    "session",
    "tunnel"
  ],
  "mirror": true,
  "steps": [
    {
      "on": "a",
      "op": "session.new",
      "args": {
        "options": {
          "max_attachments": -1
        }
      },
      "expect_error": {
        "code": "invalid_options"
      }
    },
    {
      "on": "a",
      "op": "session.new",
      "args": {
        "options": {
          "max_inflight": -1
        }
      },
      "expect_error": {
        "code": "invalid_options"
      }
    },
    {
      "on": "runner",
      "op": "pair.peers",
      "args": {
        "server": "a"
      },
      "bind": {
        "server": "pa",
        "client": "pb"
      }
    },
    {
      "on": "a",
      "op": "tunnel.over",
      "args": {
        "on": "$pa"
      },
      "bind": "carrier_a"
    },
    {
      "on": "b",
      "op": "tunnel.over",
      "args": {
        "on": "$pb"
      },
      "bind": "carrier_b"
    },
    {
      "on": "a",
      "op": "conn.pipe",
      "args": {
        "consume": "lazy"
      },
      "bind": {
        "a": "pipe_near",
        "b": "pipe_far"
      }
    },
    {
      "on": "a",
      "op": "peer.over",
      "args": {
        "on": "$pipe_near",
        "role": "client"
      },
      "bind": "near"
    },
    {
      "on": "a",
      "op": "peer.over",
      "args": {
        "on": "$pipe_far",
        "role": "server"
      },
      "bind": "far"
    },
    {
      "on": "a",
      "op": "tunnel.over",
      "args": {
        "on": "$near"
      },
      "bind": "tunnel_near"
    },
    {
      "on": "a",
      "op": "tunnel.over",
      "args": {
        "on": "$far"
      },
      "bind": "tunnel_far"
    },
    {
      "on": "a",
      "op": "tunnel.open",
      "args": {
        "on": "$tunnel_far",
        "family": "probe",
        "consume": "eager"
      },
      "bind": "machine"
    },
    {
      "on": "a",
      "op": "tunnel.accept",
      "args": {
        "on": "$tunnel_near",
        "consume": "lazy"
      },
      "bind": "up"
    },
    {
      "on": "a",
      "op": "session.new",
      "args": {
        "options": {
          "max_attachments": 2
        }
      },
      "bind": "reg",
      "note": "Two consumers is room enough for a participant and an observer, and no room for a third: the limit is what one of the refusals below is about."
    },
    {
      "on": "a",
      "op": "session.bind",
      "args": {
        "on": "$reg",
        "session": "s",
        "channel": "$up",
        "governance": {
          "decides": [
            "echo"
          ],
          "asks": [
            "reverse"
          ]
        }
      }
    },
    {
      "on": "b",
      "op": "tunnel.open",
      "args": {
        "on": "$carrier_b",
        "family": "probe",
        "after": 0,
        "consume": "eager"
      },
      "bind": "one"
    },
    {
      "on": "a",
      "op": "tunnel.accept",
      "args": {
        "on": "$carrier_a",
        "consume": "lazy"
      },
      "bind": {
        "handle": "ch_one"
      }
    },
    {
      "on": "b",
      "op": "tunnel.open",
      "args": {
        "on": "$carrier_b",
        "family": "probe",
        "after": 0,
        "consume": "eager"
      },
      "bind": "two"
    },
    {
      "on": "a",
      "op": "tunnel.accept",
      "args": {
        "on": "$carrier_a",
        "consume": "lazy"
      },
      "bind": {
        "handle": "ch_two"
      }
    },
    {
      "on": "b",
      "op": "tunnel.open",
      "args": {
        "on": "$carrier_b",
        "family": "probe",
        "after": 0,
        "consume": "eager"
      },
      "bind": "three"
    },
    {
      "on": "a",
      "op": "tunnel.accept",
      "args": {
        "on": "$carrier_a",
        "consume": "lazy"
      },
      "bind": {
        "handle": "ch_three"
      }
    },
    {
      "on": "a",
      "op": "session.attach",
      "args": {
        "on": "$reg",
        "session": "s",
        "channel": "$ch_one",
        "role": "participant",
        "origin": "one",
        "after": 0
      },
      "bind": "att_one"
    },
    {
      "on": "a",
      "op": "session.attach",
      "args": {
        "on": "$reg",
        "session": "s",
        "channel": "$ch_two",
        "role": "observer",
        "origin": "watcher",
        "after": 0
      },
      "bind": "att_watch"
    },
    {
      "on": "a",
      "op": "session.attach",
      "args": {
        "on": "$reg",
        "session": "nothing",
        "channel": "$ch_three",
        "role": "participant",
        "origin": "third",
        "after": 0
      },
      "expect_error": {
        "code": "no_session"
      },
      "note": "Every refusal below is answered with the code the layer names, which is what a consumer's server branches on; the third channel carries none of them, each being refused before the connection is anyone's."
    },
    {
      "on": "a",
      "op": "session.attach",
      "args": {
        "on": "$reg",
        "session": "s",
        "channel": "$ch_three",
        "role": "holder",
        "origin": "third",
        "after": 0
      },
      "expect_error": {
        "code": "role_invalid"
      },
      "note": "A consumer attaches as a participant or an observer, and holder is neither."
    },
    {
      "on": "a",
      "op": "session.attach",
      "args": {
        "on": "$reg",
        "session": "s",
        "channel": "$ch_three",
        "role": "participant",
        "origin": "third",
        "after": -1
      },
      "expect_error": {
        "code": "sequence_invalid"
      }
    },
    {
      "on": "a",
      "op": "session.attach",
      "args": {
        "on": "$reg",
        "session": "s",
        "channel": "$ch_three",
        "role": "participant",
        "origin": "third",
        "after": 0
      },
      "expect_error": {
        "code": "too_many_attachments"
      },
      "note": "Everything about this attach is well formed; there is simply no room, which is a refusal of its own and not one of the three above."
    },
    {
      "on": "a",
      "op": "session.bind",
      "args": {
        "on": "$reg",
        "session": "s",
        "channel": "$ch_three",
        "governance": {
          "decides": [
            "echo"
          ],
          "asks": [
            "reverse"
          ]
        }
      },
      "expect_error": {
        "code": "session_exists"
      }
    },
    {
      "on": "a",
      "op": "session.control",
      "args": {
        "on": "$reg",
        "session": "nothing",
        "attachment": null
      },
      "expect_error": {
        "code": "no_session"
      }
    },
    {
      "on": "a",
      "op": "session.control",
      "args": {
        "on": "$reg",
        "session": "s",
        "attachment": "$att_watch"
      },
      "expect_error": {
        "code": "not_controlling"
      },
      "note": "An observer never holds control, which is the same code the relay answers a deciding frame with on the wire."
    },
    {
      "on": "b",
      "op": "conn.receive",
      "args": {
        "on": "$one"
      },
      "expect": {
        "kind": "text",
        "text": "{\"version\":1,\"kind\":\"event\",\"event\":\"session.control\",\"data\":{\"holder\":null}}"
      },
      "note": "Nothing above reached a consumer: the first frame on this connection is still the one its own attach sent."
    },
    {
      "on": "a",
      "op": "session.control",
      "args": {
        "on": "$reg",
        "session": "s",
        "attachment": "$att_one"
      }
    },
    {
      "on": "b",
      "op": "conn.receive",
      "args": {
        "on": "$one"
      },
      "expect": {
        "kind": "text",
        "text": "{\"version\":1,\"kind\":\"event\",\"event\":\"session.control\",\"data\":{\"holder\":\"one\"}}"
      }
    },
    {
      "on": "a",
      "op": "attachment.state",
      "args": {
        "on": "$att_one"
      },
      "expect": {
        "holder": "one",
        "sequence": 0
      },
      "note": "The session refused eight calls and went on: control moves, and the consumer that has it is told."
    }
  ]
}
