{
  "name": "a message over the log's bound is kept cut and not replayed, since a cut message is not a message; what fits is replayed in its place, and the cursor passes what was not",
  "layer": "session",
  "needs": [
    "lazy",
    "peer",
    "pipe",
    "seam",
    "session",
    "tunnel"
  ],
  "steps": [
    {
      "on": "runner",
      "op": "pair.peers",
      "args": {
        "server": "a"
      },
      "bind": {
        "server": "pa",
        "client": "pb"
      }
    },
    {
      "on": "a",
      "op": "tunnel.over",
      "args": {
        "on": "$pa"
      },
      "bind": "carrier_a"
    },
    {
      "on": "b",
      "op": "tunnel.over",
      "args": {
        "on": "$pb"
      },
      "bind": "carrier_b"
    },
    {
      "on": "a",
      "op": "conn.pipe",
      "args": {
        "consume": "lazy"
      },
      "bind": {
        "a": "pipe_near",
        "b": "pipe_far"
      }
    },
    {
      "on": "a",
      "op": "peer.over",
      "args": {
        "on": "$pipe_near",
        "role": "client"
      },
      "bind": "near"
    },
    {
      "on": "a",
      "op": "peer.over",
      "args": {
        "on": "$pipe_far",
        "role": "server"
      },
      "bind": "far"
    },
    {
      "on": "a",
      "op": "tunnel.over",
      "args": {
        "on": "$near"
      },
      "bind": "tunnel_near"
    },
    {
      "on": "a",
      "op": "tunnel.over",
      "args": {
        "on": "$far"
      },
      "bind": "tunnel_far"
    },
    {
      "on": "a",
      "op": "tunnel.open",
      "args": {
        "on": "$tunnel_far",
        "family": "probe",
        "consume": "eager"
      },
      "bind": "machine"
    },
    {
      "on": "a",
      "op": "tunnel.accept",
      "args": {
        "on": "$tunnel_near",
        "consume": "lazy"
      },
      "bind": "up"
    },
    {
      "on": "a",
      "op": "session.new",
      "bind": "reg"
    },
    {
      "on": "a",
      "op": "session.bind",
      "args": {
        "on": "$reg",
        "session": "s",
        "channel": "$up",
        "governance": {
          "decides": [
            "echo"
          ],
          "asks": [
            "reverse"
          ]
        },
        "log": {
          "max_frame_bytes": 60
        }
      }
    },
    {
      "on": "b",
      "op": "tunnel.open",
      "args": {
        "on": "$carrier_b",
        "family": "probe",
        "after": 0,
        "consume": "eager"
      },
      "bind": "one"
    },
    {
      "on": "a",
      "op": "tunnel.accept",
      "args": {
        "on": "$carrier_a",
        "consume": "lazy"
      },
      "bind": {
        "handle": "ch_one"
      }
    },
    {
      "on": "a",
      "op": "session.attach",
      "args": {
        "on": "$reg",
        "session": "s",
        "channel": "$ch_one",
        "role": "participant",
        "origin": "one",
        "after": 0
      },
      "bind": "att_one"
    },
    {
      "on": "b",
      "op": "conn.receive",
      "args": {
        "on": "$one"
      },
      "expect": {
        "kind": "text",
        "text": "{\"version\":1,\"kind\":\"event\",\"event\":\"session.control\",\"data\":{\"holder\":null}}"
      }
    },
    {
      "on": "a",
      "op": "conn.send",
      "args": {
        "on": "$machine",
        "kind": "text",
        "text": "{\"version\":1,\"kind\":\"event\",\"event\":\"changed\",\"data\":1}"
      }
    },
    {
      "on": "b",
      "op": "conn.receive",
      "args": {
        "on": "$one"
      },
      "expect": {
        "kind": "text",
        "text": "{\"version\":1,\"kind\":\"event\",\"event\":\"changed\",\"data\":1}"
      }
    },
    {
      "on": "b",
      "op": "conn.receive",
      "args": {
        "on": "$one"
      },
      "expect": {
        "kind": "text",
        "text": "{\"version\":1,\"kind\":\"event\",\"event\":\"session.cursor\",\"data\":{\"sequence\":1}}"
      }
    },
    {
      "on": "a",
      "op": "conn.send",
      "args": {
        "on": "$machine",
        "kind": "text",
        "text": "{\"version\":1,\"kind\":\"event\",\"event\":\"changed\",\"data\":{\"text\":\"well beyond the bound the log was given\"}}"
      }
    },
    {
      "on": "b",
      "op": "conn.receive",
      "args": {
        "on": "$one"
      },
      "expect": {
        "kind": "text",
        "text": "{\"version\":1,\"kind\":\"event\",\"event\":\"changed\",\"data\":{\"text\":\"well beyond the bound the log was given\"}}"
      },
      "note": "a live frame reaches a consumer whole whatever the log keeps"
    },
    {
      "on": "b",
      "op": "conn.receive",
      "args": {
        "on": "$one"
      },
      "expect": {
        "kind": "text",
        "text": "{\"version\":1,\"kind\":\"event\",\"event\":\"session.cursor\",\"data\":{\"sequence\":2}}"
      },
      "note": "a live frame is delivered whole whatever the log kept, and its cursor is its own sequence"
    },
    {
      "on": "b",
      "op": "tunnel.open",
      "args": {
        "on": "$carrier_b",
        "family": "probe",
        "after": 0,
        "consume": "eager"
      },
      "bind": "late"
    },
    {
      "on": "a",
      "op": "tunnel.accept",
      "args": {
        "on": "$carrier_a",
        "consume": "lazy"
      },
      "bind": {
        "handle": "ch_late"
      }
    },
    {
      "on": "a",
      "op": "session.attach",
      "args": {
        "on": "$reg",
        "session": "s",
        "channel": "$ch_late",
        "role": "observer",
        "origin": "late",
        "after": 0
      },
      "bind": "att_late"
    },
    {
      "on": "b",
      "op": "conn.receive",
      "args": {
        "on": "$late"
      },
      "expect": {
        "kind": "text",
        "text": "{\"version\":1,\"kind\":\"event\",\"event\":\"session.control\",\"data\":{\"holder\":null}}"
      }
    },
    {
      "on": "b",
      "op": "conn.receive",
      "args": {
        "on": "$late"
      },
      "expect": {
        "kind": "text",
        "text": "{\"version\":1,\"kind\":\"event\",\"event\":\"changed\",\"data\":1}"
      },
      "note": "the replay gives the small frame as it was"
    },
    {
      "on": "b",
      "op": "conn.receive",
      "args": {
        "on": "$late"
      },
      "expect": {
        "kind": "text",
        "text": "{\"version\":1,\"kind\":\"event\",\"event\":\"session.cursor\",\"data\":{\"sequence\":1}}"
      },
      "note": "the frame the log cut is delivered as nothing and carries no cursor of its own"
    },
    {
      "on": "b",
      "op": "conn.receive",
      "args": {
        "on": "$late"
      },
      "expect": {
        "kind": "text",
        "text": "{\"version\":1,\"kind\":\"event\",\"event\":\"session.cursor\",\"data\":{\"sequence\":2}}"
      },
      "note": "the frame the log kept cut is the replay's last, so the replay ends by saying where it reached: a consumer resuming from this cursor reads the log on rather than over the frame it was never given"
    },
    {
      "on": "b",
      "op": "conn.receive",
      "args": {
        "on": "$late",
        "within_ms": 250
      },
      "expect_error": {
        "code": "timeout"
      },
      "note": "the frame the log kept cut is not replayed: a channel that speaks the family is given no half a message"
    },
    {
      "on": "a",
      "op": "session.changes",
      "args": {
        "on": "$reg"
      },
      "expect": {
        "$contains": [
          {
            "kind": "frame_appended",
            "sequence": 1
          },
          {
            "kind": "frame_appended",
            "sequence": 2
          }
        ]
      }
    }
  ]
}
